{
  "schemaVersion": "1.0.0",
  "asOf": "2026-08-02",
  "review": {
    "status": "approved",
    "reviewedBy": "Hermes source-gate",
    "reviewedAt": "2026-08-02T05:06:19Z"
  },
  "records": [
    {
      "id": "bestow",
      "name": "Bestow",
      "aliases": [],
      "headquartersCountry": "United States",
      "tmtVertical": "Fintech/Payments/Insurtech",
      "businessModel": "SaaS",
      "customerType": "B2B",
      "monetization": [
        "Subscription",
        "Usage-based"
      ],
      "lifecycleStage": "growth_late_stage",
      "sourceVintage": "2025-05-13",
      "sources": [
        {
          "url": "https://techcrunch.com/2025/05/13/insurtech-bestow-lands-120m-series-d-from-goldman-sachs-smith-point-capital/",
          "date": "2025-05-13",
          "type": "reputable_media",
          "confidence": "high"
        }
      ],
      "confidence": "high",
      "privateStatusBoundary": {
        "status": "private",
        "asOf": "2025-05-13",
        "sourceUrl": "https://techcrunch.com/2025/05/13/insurtech-bestow-lands-120m-series-d-from-goldman-sachs-smith-point-capital/",
        "confidence": "high"
      },
      "investabilityAccessLane": "strategic_co_invest",
      "sector": "Insurtech",
      "subSector": "Life insurance core SaaS and underwriting infrastructure",
      "companyDescription": "从D2C保险转型为承保、产品上线和保单运营基础设施，服务大型寿险机构，具有核心系统替代和使用量扩张逻辑。",
      "latestFinancing": {
        "roundType": "Series D",
        "amountDisplay": "$120m",
        "announcedDate": "2025-05-13",
        "financingType": "equity",
        "sourceUrl": "https://techcrunch.com/2025/05/13/insurtech-bestow-lands-120m-series-d-from-goldman-sachs-smith-point-capital/"
      }
    },
    {
      "id": "chapter",
      "name": "Chapter",
      "aliases": [],
      "headquartersCountry": "United States",
      "tmtVertical": "Fintech/Payments/Insurtech",
      "businessModel": "Services",
      "customerType": "B2C",
      "monetization": [
        "Other"
      ],
      "lifecycleStage": "growth_late_stage",
      "sourceVintage": "2025-04-16",
      "sources": [
        {
          "url": "https://techcrunch.com/2025/04/16/chapter-a-medicare-startup-with-links-to-vance-thiel-and-ramaswamy-just-raised-a-round-at-1-5b-valuation/",
          "date": "2025-04-16",
          "type": "reputable_media",
          "confidence": "medium"
        }
      ],
      "confidence": "medium",
      "privateStatusBoundary": {
        "status": "private",
        "asOf": "2025-04-16",
        "sourceUrl": "https://techcrunch.com/2025/04/16/chapter-a-medicare-startup-with-links-to-vance-thiel-and-ramaswamy-just-raised-a-round-at-1-5b-valuation/",
        "confidence": "medium"
      },
      "investabilityAccessLane": "relationship_development",
      "sector": "Insurtech",
      "subSector": "Medicare advisory and insurance distribution",
      "companyDescription": "以医生、医院和药品覆盖数据辅助老年人选险，聚焦高复杂度、高留存潜力的保险消费决策场景。",
      "latestFinancing": {
        "roundType": "funding round",
        "amountDisplay": "$75m",
        "announcedDate": "2025-04-16",
        "financingType": "equity",
        "sourceUrl": "https://techcrunch.com/2025/04/16/chapter-a-medicare-startup-with-links-to-vance-thiel-and-ramaswamy-just-raised-a-round-at-1-5b-valuation/"
      }
    },
    {
      "id": "federato",
      "name": "Federato",
      "aliases": [],
      "headquartersCountry": "United States",
      "tmtVertical": "Fintech/Payments/Insurtech",
      "businessModel": "SaaS",
      "customerType": "B2B",
      "monetization": [
        "Other"
      ],
      "lifecycleStage": "growth_late_stage",
      "sourceVintage": "2024-11-20",
      "sources": [
        {
          "url": "https://techcrunch.com/2024/11/20/federato-fixes-insurance-risk-analysis-with-ai-raises-40m/",
          "date": "2024-11-20",
          "type": "reputable_media",
          "confidence": "medium"
        }
      ],
      "confidence": "medium",
      "privateStatusBoundary": {
        "status": "private",
        "asOf": "2024-11-20",
        "sourceUrl": "https://techcrunch.com/2024/11/20/federato-fixes-insurance-risk-analysis-with-ai-raises-40m/",
        "confidence": "medium"
      },
      "investabilityAccessLane": "relationship_development",
      "sector": "Insurtech",
      "subSector": "Insurance underwriting and RiskOps software",
      "companyDescription": "切入保险公司的核心承保决策层，而非外围数字营销；RiskOps整合数据、风险选择和工作流，并已进入大型保险机构。",
      "latestFinancing": {
        "roundType": "financing",
        "amountDisplay": "$40m",
        "announcedDate": "2024-11-20",
        "financingType": "equity",
        "sourceUrl": "https://techcrunch.com/2024/11/20/federato-fixes-insurance-risk-analysis-with-ai-raises-40m/"
      }
    },
    {
      "id": "harper",
      "name": "Harper",
      "aliases": [],
      "headquartersCountry": "United States",
      "tmtVertical": "Fintech/Payments/Insurtech",
      "businessModel": "Services",
      "customerType": "B2B",
      "monetization": [
        "Other"
      ],
      "lifecycleStage": "series_a_b",
      "sourceVintage": "2026-02-25",
      "sources": [
        {
          "url": "https://techcrunch.com/2026/02/25/ai-insurance-brokerage-harper-raises-45m-series-a-and-seed/",
          "date": "2026-02-25",
          "type": "reputable_media",
          "confidence": "high"
        }
      ],
      "confidence": "high",
      "privateStatusBoundary": {
        "status": "private",
        "asOf": "2026-02-25",
        "sourceUrl": "https://techcrunch.com/2026/02/25/ai-insurance-brokerage-harper-raises-45m-series-a-and-seed/",
        "confidence": "high"
      },
      "investabilityAccessLane": "direct_primary",
      "sector": "Insurtech",
      "subSector": "AI-native commercial insurance brokerage",
      "companyDescription": "以AI自动化投保路由、材料收集和承保沟通，将传统商业保险经纪改造成接近软件效率的运营模型。",
      "latestFinancing": {
        "roundType": "Series A and seed",
        "amountDisplay": "$47m",
        "announcedDate": "2026-02-25",
        "financingType": "equity",
        "sourceUrl": "https://techcrunch.com/2026/02/25/ai-insurance-brokerage-harper-raises-45m-series-a-and-seed/"
      }
    },
    {
      "id": "mercury",
      "name": "Mercury",
      "aliases": [],
      "headquartersCountry": "United States",
      "tmtVertical": "Fintech/Payments/Insurtech",
      "businessModel": "Services",
      "customerType": "B2B",
      "monetization": [
        "Other"
      ],
      "lifecycleStage": "pre_ipo",
      "sourceVintage": "2025-03-26",
      "sources": [
        {
          "url": "https://techcrunch.com/2025/03/26/fintech-mercury-lands-300m-in-sequoia-led-series-c-doubles-valuation-to-3-5b/",
          "date": "2025-03-26",
          "type": "reputable_media",
          "confidence": "high"
        }
      ],
      "confidence": "high",
      "privateStatusBoundary": {
        "status": "private",
        "asOf": "2025-03-26",
        "sourceUrl": "https://techcrunch.com/2025/03/26/fintech-mercury-lands-300m-in-sequoia-led-series-c-doubles-valuation-to-3-5b/",
        "confidence": "high"
      },
      "investabilityAccessLane": "relationship_development",
      "sector": "Fintech",
      "subSector": "Business banking and financial operations software",
      "companyDescription": "从企业账户入口扩展为支付、卡、应付、应收及费用管理操作系统，兼具高频交易数据和交叉销售能力。",
      "latestFinancing": {
        "roundType": "Series C",
        "amountDisplay": "$300m",
        "announcedDate": "2025-03-26",
        "financingType": "equity",
        "sourceUrl": "https://techcrunch.com/2025/03/26/fintech-mercury-lands-300m-in-sequoia-led-series-c-doubles-valuation-to-3-5b/"
      }
    },
    {
      "id": "plaid",
      "name": "Plaid",
      "aliases": [],
      "headquartersCountry": "United States",
      "tmtVertical": "Fintech/Payments/Insurtech",
      "businessModel": "Other",
      "customerType": "B2B",
      "monetization": [
        "Other"
      ],
      "lifecycleStage": "pre_ipo",
      "sourceVintage": "2025-04-03",
      "sources": [
        {
          "url": "https://techcrunch.com/2025/04/03/fintech-plaid-raises-575m-at-6-1b-valuation-says-it-will-not-go-public-in-2025/",
          "date": "2025-04-03",
          "type": "reputable_media",
          "confidence": "high"
        }
      ],
      "confidence": "high",
      "privateStatusBoundary": {
        "status": "private",
        "asOf": "2025-04-03",
        "sourceUrl": "https://techcrunch.com/2025/04/03/fintech-plaid-raises-575m-at-6-1b-valuation-says-it-will-not-go-public-in-2025/",
        "confidence": "high"
      },
      "investabilityAccessLane": "company_approved_secondary",
      "sector": "Fintech Infrastructure",
      "subSector": "Open finance data, identity, fraud and payment APIs",
      "companyDescription": "已从银行账户连接扩展到身份、信用、反欺诈和支付，处于多个金融应用与银行之间的基础设施控制点。",
      "latestFinancing": {
        "roundType": "common stock financing",
        "amountDisplay": "$575m",
        "announcedDate": "2025-04-03",
        "financingType": "equity",
        "sourceUrl": "https://techcrunch.com/2025/04/03/fintech-plaid-raises-575m-at-6-1b-valuation-says-it-will-not-go-public-in-2025/"
      }
    },
    {
      "id": "rain",
      "name": "Rain",
      "aliases": [],
      "headquartersCountry": "United States",
      "tmtVertical": "Fintech/Payments/Insurtech",
      "businessModel": "Usage-based",
      "customerType": "B2B2C",
      "monetization": [
        "Transaction fees"
      ],
      "lifecycleStage": "series_a_b",
      "sourceVintage": "2025-04-08",
      "sources": [
        {
          "url": "https://techcrunch.com/2025/04/08/los-angeles-based-rain-raised-a-75m-series-b-in-another-good-sign-for-fintech/",
          "date": "2025-04-08",
          "type": "reputable_media",
          "confidence": "high"
        }
      ],
      "confidence": "high",
      "privateStatusBoundary": {
        "status": "private",
        "asOf": "2025-04-08",